<?xml version="1.0" encoding="UTF-8"?>
<chc:ChaosHarvesterConfiguration xmlns:chc="http://www.example.org/ChaosHarvesterConfiguration" xmlns:xsi="http://www.w3.org/2001/XMLSchema-instance" xsi:schemaLocation="http://www.example.org/ChaosHarvesterConfiguration ../schemas/ChaosHarvesterConfiguration.xsd ">
  <chc:Organisation>DR TU Innovation</chc:Organisation>
  <chc:Project>Some internal project</chc:Project>
  <chc:Description>This is simply a test ..</chc:Description>
  <chc:Modes/>
  <chc:Processors/>
  <chc:Filters>
    <chc:Filter>
      <chc:name>chc:name</chc:name>
      <chc:class className=""/>
    </chc:Filter>
  </chc:Filters>
  <chc:ChaosConfiguration>
    <chc:URL fromEnvironment="CHAOS_URL"/>
    <chc:Email fromEnvironment="CHAOS_EMAIL"/>
    <chc:Password fromEnvironment="CHAOS_PASSWORD"/>
  </chc:ChaosConfiguration>
  <chc:IncludePaths>
    <chc:path>chc:path</chc:path>
  </chc:IncludePaths>
</chc:ChaosHarvesterConfiguration>
